"You found out who the Five were through Melissan's scheming... and through, in no small part, my own. But who is to say that things might not have been different? Who are *you* to say that things might have been different?","Dowiedziałaś się kim była Piątka dzięki knowaniom Melissany... i w równie dużej mierze, dzięki moim. Ale kto może stwierdzić, że to wszystko nie mogło potoczyć się inaczej? Kim TY jesteś, by twierdzić, że mogłoby być inaczej?"
"You have parleyed with Balthazar, the greatest of the Bhaalspawn besides yourself, god-child. You are to be commended. Your journey is nearly at its end.","Zawarłaś układ z Balthazarem, obok ciebie najpotężniejszym z pomiotów Bhaala, boskie dziecię. Chwała ci za to. Twoja podróż niemalże dobiegła końca."
"You may be strong, <CHARNAME>, but you are indeed a fool to think us weak. I shall take your soul for my own, I swear it!","Może i masz siłę, <CHARNAME>, ale jesteś głupia, jeśli uważasz nas za słabych. Zagarnę twoją duszę dla siebie, przysięgam!"
"You may have gained some crude and rudimentary control over your abilities in the interim, but even I have learned a thing or two... delusions or no. And Melissan has given me the opportunity to personally see an end to your ascension... consider it a favor returned.","Może i uzyskałaś jakąś szczątkową i prymitywną kontrolę nad swymi zdolnościami, ale i ja nauczyłem się tego i owego... Złudzenia nie mają tu nic do rzeczy. Poza tym Melissana dała mi szansę, abym osobiście mógł położyć kres twojemu wyniesieniu... Odwzajemnię ci w ten sposób taką samą przysługę."
"You mistake the path for the journey, my friend. Whatever paths you have taken since leaving Candlekeep, the journey has ended here as it was always meant to. Destiny masters us... we do not master it.","Nie zauważasz, że różne drogi mogą prowadzić do jednego celu podróży, przyjaciółko. Niezależnie od tego, jakie ścieżki obrałaś po opuszczeniu Candlekeep, twoja podróż kończy się tutaj, tak jak zawsze miało być. Przeznaczenie panuje nad nami... a nie my nad nim."
"You place your hand within the energies of the pool and draw the essence into yourself, diverting it away from Melissan. Boundless power fills you briefly, and while most of it dissipates a portion fuels your inner energies. You are now immune to death magics and vorpal effects, and have also gained the ability to unleash the power within you as a short burst of destructive power. The energies also restore the powers of all present.","Wkładasz rękę do wiru energii znajdującego się w sadzawce i czerpiesz z niej esencję, odbierając ją Melissanie. Nieograniczona moc wypełnia cię przez krótką chwilę i choć większość jej ulatnia się, to mała cząstka łączy się z twą wewnętrzną energią. Jesteś teraz niewrażliwa na magię śmierci i uderzenia worpalne, a także uzyskałaś zdolność dania upustu swej wewnętrznej siły w postaci krótkotrwałej eksplozji niszczącej mocy. Energia dodatkowo odnawia moce wszystkich obecnych."
"You plant a seed of doubt in me, <CHARNAME>, and I begin to wonder. Yet... it seems that my destiny may differ from yours. I have no heavenly guidance. Perhaps my path has been made for me, yet.","Zasiałaś we mnie ziarno wątpliwości, <CHARNAME>, i zaczynam się zastanawiać. Mimo to... zdaje się, że moje przeznaczanie różni się od twojego. Ja nie mam żadnego niebiańskiego przewodnika. Być może moja ścieżka została już jednak ustalona."
